footloose has only one goal in mind to reel in an audience with cheesy sentiment and feel good antics and i hate to admit it i fell for it the movie is about a teenager bacon who moves to a small town from the big city and discovers that dancing has been banned by the local reverend lithgow he ends up falling for the preachers daughter singer and showing the whole town what the magic of dance can do as mentioned at the beginning of this review footloose is an extremely hokey and predictable teen drama there are virtually no surprises and the writing is second rate so why did i enjoy it so much for one thing the cast is great kevin bacon oozes charisma in an early role were rooting for him right from the start and unlike most films of this genre bacon doesnt play him as the rebel without a clue sort yes he does rebel but hes also polite when he needs to be and he never broods the rest of the cast is equally impressive john lithgow seen here playing a normal guy for a change is playing a man who would normally be a flat out villian but lithgow plays him as a concerned father who is trying to do what he feels is best for his daughter by the end of the film we feel a genuine sense of love and understanding between him and the lori singer character another nice touch is the music we see the parents of the kids complaining that the music they listen to is filled with sexual innuendos but thats not true at all the title track performed by kenny loggins is upbeat and fun during the final sequence i was overcome with the urge to get off the couch and start dancing of course i soon realized that would be a little pathetic anyway footloose is a charming little surprise dont let the premise prevent you from watching it it sucked me in and itll do the same to you, 1
minor plot spoilers in review no major spoilers are in review the previous two alien films have each had their own unique styles to them the ridley scotts alien was very much a stylistic suspense film james camerons aliens was much more of an action film and i liked each film separately for which it was now alien is out and it is its own film in the same right that alien and aliens were unlike aliens alien requires that you have seen aliens this is very important as the story picks up exactly were aliens left off the survivors of the expedition to lv are returning home after battling and beating the aliens the climactic fight scene between ripley and the mother alien on the sulaco in aliens left behind one item an egg in the opening sequence we see the egg hatch find its quarry which leads to a fire aboard the sulaco when the facehugger is injured an leads the sulaco to jettison the hypersleep tubes in an escape vessel this vessel crash lands on fury everyone in the vessel is killed except ripley the facehugger is jettisoned with them and survives the crash fury is an ex miningmaximum security prison when closed down some of the lifer prisoners decided to stay and live out the remaining years on the planet all the prisoners are men who have not seen a woman in many years ripleys arrival sparks a problem with the inmates as for the new haircut that ripley and the prisoners sport there is an infestation of lice on the planet being an ex prison means that there is no way off the planet and no weapons so the prisoners and ripley are off to face the alien on their own i will not go into detail but you can guess what happens here the alien is loose and no one believes ripleys outstanding story she finds comfort in the arms of the colonys doctor yes after years ripley has sex it is not gratuitous in fact we dont even see them kiss but it is just as well a sweaty sex scene would not have worked in the context of the film there is a lot more gore in alien in fact i would guess to say that there is more in alien than either of the earlier two it also sports a new alien with legs i wont say how but it leads us to believe a few new things about the alien and its cycle which i am sure will be explored in alien sigourney weaver is back as ripley and provides another excellent performance of this character her scene during the autopsy of newt is enough to garnish her another academy nomination the rest of the cast is also quite good notably charles dance as the doctor with whom ripley finds momentary escape from fury alien has a very distinct look this is due largely to its director david fincher mr fincher who until now has only directed music videos and commercials has done an incredible job here his direction is excellent and makes this film come to life in ways no alien film has before for mr fincher i see a long prosperous career ahead of him the music was also done by a newcomer to the film industry elliot goldenthal has created a deeply moving score which lends itself to the claustrophobic setting that the alien series been set in this time the score is not so much a rip off of star trek ii james horners aliens this score has a choral back up at times and even lends itself to the old style of ennio morricone scoring this is a great score the ending to alien is quite good there were times i thought that hollywood would come in and screw it up but it played very nicely i will not ruin the ending for you go see the film i consider it to be a much more involved film than any of the other films released so far this season alien is a worthy successor to aliens and alien and when they make alien perhaps they will be able to find yet another new direction to take it in, 1
wild things is a suspenseful thriller starring matt dillon denise richards and neve campbell that deals with all the issues sex love murder and betrayal the setting of the film is a town named blue bay it consists of many swamps and slums and on the other hand rich estates owned by the towns different benefactors the film opens just before the beginning of a senior seminar at the towns ritzy expensive high school it is here that we meet all of the core characters theres guidance counselor sam lombardo police officers ray duquette and gloria perez dark mysterious senior suzie toller and the popular head cheerleader kelly van ryan we first see that all of the senior girls are smitten with the handsome guidance counselor but none more than kelly throughout the first portion of the film we see how far kelly will go to get sam until she accuses him of rape shortly after suzie too confesses that sam raped her as well this pushes kellys sex craving mother sandra to stop at nothing until sam is convicted during the trial kelly gives a teary confession of how sam raped her however it is later revealed by suzie that sam never raped either of the girls it was all a vengeful plan against the guidance counselor after sam is cleared kellys mother pays sam a very substantial amount of cash in order for him not to sue her it is then revealed that sam kelly and suzie were all in on it together it is here that the film starts to reveal just who is being honest with each other and who has their own hidden agenda matt dillon stars as sam lombardo sam is the kind of guy that every woman would like to sink their claws into and sam obviously knows it and uses it to his own advantage he isnt the obvious best of actors but dillon does give a convincing performance however his talents seem to be rendered useless near the end of the film making it look as though his character has lost all of his ethics and principles although he never had many to start out with in the first place neve campbell who most people relate to scream and scream plays blue bay outcast suzie toller suzie obviously has some serious issues to deal with which are obvious from her first scene in the film campbell is very successful with this character adding the slightest bit of charm to a seemingly repulsive character and making her fun to watch playing kelly van ryan is denise richards kelly is your typical rich sexy head cheerleader who thinks she can have any man she choses like her sexpot mother sandra one of the most interesting things about this film is how it compares and contrasts the relationship between kelly and her mother denise richards still hot off the press from starship troopers gives the most interesting performance in the entire film in the beginning kelly looks to be a paper thin character but richards adds a little more spice and ultimately makes the character not only sexy but dominating as well kevin bacon gives one of his fair performances as ray duquette this character looks to be one of the most boring predictable in the film however it is a relationship revealed between him and suzie that adds depth to his story still the film doesnt seem to gain much from bacons performance only his name in the supporting cast theresa russell plays the much oversexed sandra van ryan daphne rubin vega gives an unappealing performance as cop gloria perez and bill murray shines as sams lawyer ken bowden hats off to murray for adding the perfect touch of comedy to the film although wild things was displayed by the press as being an erotic thriller the eroticism which is portrayed with good taste is kept to a minimum and focuses more on the plot and the relationships between the characters this is truly a very good film worth seeing if your looking for a movie with a thick plot filled with its share of twists, 1
the long kiss goodnight r meryl streep tried it and failed even pamela anderson lee made an attempt but fell flat on her well bared assets however geena davis could very well become the first bankable american female action star with the long kiss goodnight a preposterous but incredibly fun action thriller directed by her husband renny harlin davis plays samantha caine a mousy suburban school teacher and mother whose memories only go back eight years with the help of ethically questionable private detective mitch hennessey samuel l jackson she slowly remembers and reclaims her past as charly baltimore tough as nails cia operative needless to say with the reappearance of samanthacharly comes the appearance of an assortment of no goodniks out to erase more than her memory shane black netted a cool mil for his script im not so sure if his prose is truly deserving of such a hefty price tag but for what its worth it delivers the goods like blacks previous work such as lethal weapon and the last boy scout the script juggles some impressive action scenes with funny quirky dialogue the humor especially works well in this case for the story is so preposterous that the laughs help to keep things from taking things too seriously but theres no argument that the more unbelievable sequences are original and entertaining as hell who can resist the sight of davis tossing her daughter from a hole in her house into the nearby treehouse or chasing after a car while ice skating jackson and davis make a good team jackson is funny as ever as ever in fact his spirited line deliveries especially when he first appears are more than reminiscent of his work as jules in pulp fiction as good as he is the one who should benefit the most from this project is davis who shows much promise as an action heroine what makes her so effective and why she should succeed where streep and lee failed is that she doesnt take herself too seriously she is obviously in on the joke slyly taking jabs at herself and at the situation this is not to say that she doesnt need work sometimes she lays on the toughness a bit too thick and comes off too much as a caricature but should the public embrace the film and in turn the notion of a kick ass female davis could have found her special niche it seems as if davis and harlins first collaboration the middling pirate epic cutthroat island was just a dress rehearsal albeit a very costly one for long kiss in which the wife husband team hit their action stride anyone simply looking for a fun escapist entertainment that requires little to no thinking will find this film to be a more than welcome kiss, 1
if theres one thing in common about all of hollywoods major studios its that their productions are moving toward mainstream more and more although twentieth century fox and new line cinema have spawned subsidiaries which specialize in independant or controversial motion pictures fox searchlight and fine line respectively its obvious theres no significant movement underway to promote inventive ideas at the theater so when a movie like gary ross pleasantville comes along wrapped in a blanket of innovative ideas and served up on a platter of fine production its a welcome change of pace for all who frequent the cineplexes although the atmosphere and buzz about the movie are cheery and lighthearted pleasantville should not be mistaken for a no thought movie quite the opposite is true in fact as director ross skillfully brings a narrative with intense and intelligent undertones to the screen the story both about the joys of living life to the fullest as well as the social ills of segregation captures the essence of statement making in the cinema not in recent memory has a movie carried such weight of theme into widescale distribution and even if mass audiences fail to see the ingenuity of ross work it is still a testament that his picture was considered worthy enough kudos to both he and his production staff for putting together this fine picture it stars tobey maguire and reese witherspoon as two nineties teenagers who through quite a bit of luck find themselves zapped into a fifties sitcom named pleasantville maguire as the reserved bud parker is perfect for the pseudo world but the rebellious mary sue witherspoon is not at all made for the father knows best times its not long before she sets the town of pleasantville on end and begins to teach the townspeople in a quite unlikely way what life is really like soon hues of color creep into the black and white world and while some embrace the change in the passion of realism others fear the strangeness at one end is a soda shop owner turned painter named mr johnson jeff daniels and at the other end is a close minded mayor j t walsh and his chamber of commerce but the two sides are simply fronts for a clash of ideas that soon involves the entire town fine performances are turned in all around maguire and witherspoon are effective as the leads but the true complements go out to jeff daniels and j t walsh in his latest and final posthumous performance daniels brings an atmosphere of awe inspiration and hope to his character whereas walsh simply drips of sinister closemindedness almost to the point where you can sense gene hackmans envy for daniels its his most commendable performance of the last three years or more and for walsh its a complementary exclamation point on a fine career also of lesser note is the supporting role by joan allen and in viewing the entire cast works well together from start to finish theres not much to dislike about pleasantville and its dynamic nature makes it the perfect movie for those who want serious as well as those who dont, 1
crazybeautiful suffers from the damned if you do damned if you dont syndrome after a spate of flighty cookie cutter teen films the romantic drama addresses alcoholism and parental loss along with its love story but rather than applaud the production early reviews have dismissed it as an overblown afterschool special even worse in the wake of federal trade commission hearings that blasted the industry for marketing violent and sexual movies to young people the studio got a case of the heebie jeebies and forced director john stockwell to re shoot scenes and cut footage to tone things down needless to say the filmmaker was frustrated we were trying to make a cautionary tale he told newsweek and we couldnt show the behavior we were trying to caution people away from regardless the film works thanks to exceptional performances from its lead players and a script determined to transcend stereotypes crazybeautiful is quality fare good enough that i half expected the summer movie crap police to walk into the press screening and confiscate the print for failure to incorporate explosions and poop jokes set in pacific palisades calif the story follows the burgeoning relationship between two teens every morning and evening carlos nunez jay hernandez takes a two hour bus ride in order to attend pacific high school an honor student and star athlete carlos is responsible modest and focused as he works on securing a place in the naval academy all is well until he meets nicole oakley kirsten dunst the daughter of a rich congressman bruce davison nicole is a drunk apparently hell bent on self destruction carlos is smart enough to recognize the danger in getting involved with her but he is only human and she has the greatest smile plus as her father notes she has a real knack for drawing others into her downward spiral as with save the last dance crazybeautiful god how i hate lower case titles takes situations that look stale on paper and makes them seem fresh while noting the racial and social differences between the kids the screenplay dances around most of the clich s there are still several mtv moments though the filmmakers make a point to give characters that crucial extra bit of shading that turns them into individuals instead of stereotypes and the actors take it from there cute as a button dunst forces the viewer to share the pain beneath nicoles behavior she is credible enough that when dad urges carlos to get away from her before she drags him down i hoped the boy would listen as carlos hernandez is a revelation hunky without looking like the product of a hollywood design team the young man can really act we will see a lot of this guy in the future aside from its title the biggest problem with crazybeautiful is its ending which wraps everything up too fast and too tidy after carefully presenting credible characters and situations the conclusion feels rushed and lazy still this is the kind of film that deserves accolades from critics instead of cheap shots afterschool special my ass crazybeautiful is the real deal, 1
why do so many childrens films treat their target audience with utter contempt too many of those who write or direct for childrens movies assume that the kids just cant handle serious thoughtful discussions on meaningful issues the iron giant which was directed and co written by brad bird late of such animated series as the simpsons and king of the hill assumes that not only can children handle such discussions but that they can do so while being entertained at the same time the iron giant holds absolutely no contempt for the young people in the audience making it a film thats enjoyable for both children and adults alike hogarth hughes voice of eli marienthal is a spirited young lad who lives with his hard working single mother annie jennifer aniston in a small town in maine after staying up late and watching scary movies on a night his mother is away hogarth treks out into the forest to investigate what has stolen his antenna and ruined his tv reception he comes across a giant robot vin diesel from space that eats metal for food after saving the robot nicknamed the iron giant from electric shock hogarth befriends the creature and takes him in as a pet of sorts because of damage he suffered upon landing the giant has forgotten what his original mission was so he just follows hogarth around like a lost puppy realizing he cant just keep the giant in a barn all the time and that the giant needs food he takes him to a junkyard owned by dean harry connick jr an eccentric artist who assembles sculptures out of scrap iron in his spare time it soon becomes apparent that dean and hogarth cant keep the giant a secret forever because a government spook named kent mansley christopher mcdonald has been brought in to investigate mysterious sightings in the surrounding forest area and considers the giant a threat to national security he suspects hogarth knows something about the giant and takes up residence in hogarths house as a lodger meanwhile the giant begins to exhibit ominous behavior that suggests he was built to be a weapon of some kind the iron giant is exactly what family films ought to be because it doesn t talk down to its audience the story is simple very simple about an alien being that drops out of the sky and befriends a young boy its very similar to the spielberg classic e t and such comparisons are actually deserved in the case of the iron giant the film holds many of the better elements of spielbergs film such as the ability to be sentimental without turning sappy the film delivers several serious messages the most important of which is ones ability to choose ones own fate hogarth teaches the giant to go against his programming and become what he wants to be a hero the final sequence is touching and appropriate though i wont give it away i will say that very few will be disappointed the animation while not up to disney standards what could be after tarzan is good enough to make you forget youre watching a cartoon the giant is computer animated while the human characters are all hand drawn the old fashioned way the characters faces are done quite well drawn realistically enough to make the personalities credible but the features are exaggerated so as to allow for the cartoonish expressions that provide for comic relief fine voice work is turned in by young eli marienthal as hogarth and jennifer aniston is surprisingly convincing as his waitress mother harry connick jr does a nice characterization as dean and i really enjoyed the voice work of john mahoney of tvs frasier as an army general called in by agent mansley unlike several cartoon features each character is actually a developed personality rather than a stereotype and is actually integral to the plot rather than being a superfluous comic relief sidekick a clich disney still hasnt ditched dean for example could have been a stereotypical beatnik his character profile seems to suggest that but he is presented as a character with real emotions thoughts and motivations even the heavy agent mansley is not a villain who does bad things simply because he wants to but out of his own fear and paranoia a lesser animated feature would have drawn up paper thin stereotypes and figure the kids wont mind but the iron giant has clearly put a little work into making the characters real and it pays off the film isnt only around to deliver heavy handed messages though its also very funny and the humor is of the kind that both children and adults will enjoy the scenes in which hogarth teaches the giant to do certain things such as dive into a pool are handled well and director brad bird clearly has a sense of comic timing having worked on the simpsons for many years a sequence where hogarth and mansley attempt to outlast one another by trying to stay awake is very nicely timed and also extremely clever the film even takes some jabs at americas nuclear paranoia during the early stages of the cold war satirizing the lame safety films shown to grade school students that tell them to duck and cover in the event of a nuclear attack the iron giant has much more of a satirical edge to it than most family films and the edgy humor is actually quite refreshing instead of seeing people get bonked on the head we get well timed clever gags that seem to have required some imagination to come up with when you get right down to it the iron giant is no more than the story of a boy and his robot the story is so straightforward so quaint that it ultimately becomes charming though i enjoy the complex plotting of film noir as much as the next person when it comes to family entertainment simple is the way to go its akin to one of those bedtime stories your father told that had you hanging on his every word but its not the story that sets the film above others of its kind but rather the elements that go into the story namely real characters and thoughtful dialogue which the iron giant has in spades, 1
susan grangers review of the closet miramax films in this hilarious french farce a shy boring accountant daniel auteil named francois pignon discovers hes going to be fired from his job at a condom factory lonely and distraught he contemplates suicide but then he runs into belone michel aumont an elderly homosexual neighbor who suggests a sex discrimination lawsuit to intimidate management as evidence belone concocts provocative photographs of pignon locked in a leather clad embrace with another man and mails them anonymously to pignons boss when the racy snapshots start circulating around the factory not only does pignon get his job back but he suddenly finds himself the focus of attention as an openly gay man his lusty supervisor michele laroque is so intrigued that she wonders if perhaps she could change his sexual preferences even his ex wife alexandra vandernoot and indifferent teenage son stanislas crevillen drop their disdain but not everyone is enchanted a mucho macho co worker felix gerard depardieu a self righteous homophobe is stunned and repulsed when hes forced by the pr director thierry lhermite to grovel and court pignons friendship or risk losing his own job writerdirector francis verber artfully milks the farcical comedy as he dissects the hypocrisy of political correctness veering off track only occasionally into pedophilia daniel auteuil the widow of saint pierre is delightful particularly with a blown up condom perched on his head riding on a float in a gay pride parade and gerard depardieu delivers one of his most restrained and effective performances on the granger movie gauge of to the closet is a frankly sexual adult its so clever in fact that hollywood is already planning to re make it in english like la cage aux folles, 1
