synopsis leonard shelby pearce is a former insurance investigator on the trail of the man who killed his wife leonard has only a few clues to the murderers identity to make matters worse he suffers from a condition which inhibits the creation of short term memories meaning that leonard is always forgetting what happened just minutes earlier because of this leonard is forced to rely on notes he leaves for himself memento traces the investigation back in time from its apparent culmination review memento is the sort of movie i wish id written i can think of no higher praise than that i am envious that nolan has concocted such a brilliant involved original movie as this an instant film noir classic memento is virtually flawless the script is unlike any i have ever seen a notable achievement in these days of recycled hollywood homogeneity although the idea of starting at the conclusion of the plotline and then moving backward in time to the start is not entirely new never before have i witnessed it executed with such flair and coherence memento is endlessly exciting and inventive a rare story which keeps the viewers guessing during the film itself and mulling over its connotations long after leaving the theatre and it is not merely an exercise in cerebrality there is plenty of action and an unexpected dose of humour to keep the proceedings lively nolans direction is equally effective never losing its crispness and clarity despite memento s challenging gimmick and to top everything off all the performances rise to the occasion pierce is terrific as the troubled leonard moss shows great range as enigmatic natalie and pantolianos teddy achieves a splendidly affable yet sinister quality memento may be the years best screenplay and is certainly amongst the top theatrical attractions of, 1
after having heard so many critics describe return to me as an old fashioned hollywood romance i kept asking myself going into this movie what exactly is an old fashioned hollywood romance what made return to me old fashioned and old hollywood was it the tunes from sinatra etc legendary singers the senior citizens in the film constantly harp on was it the glamorous sophisticated feel the charisma of the two leads even now i cant say that i have gotten any closer to the real answer because i havent see that many old fashioned hollywood romances i dont think any of the romances ive seen have been classified as such which leaves me the option of vaguely agreeing with my fellow critics return to me was old fashioned in the sense that it reminded me of the way the younger generation perceive venerated old hollywood magic the way i perceive cinnamon spice and apple cider it was traditional magical we knew it couldnt be too daring or have any surprising plot twists that many cynical modern romances are apt to throw in it was a romance told with such endearing simplicity tenderness and love from director bonnie hunt that it couldnt help but sparkle with charm despite its shortcomings the film owes a lot of what it has to bonnie hunts direction from the very first birds eye view of chicago zooming in slowly toward the insignificant bob rueland david duchovny accompanied by the return to me ballad by whom we can tell were in for something sweet the scenes between the characters are endearing truthful with just a hint of fantasy real people dont act that way real people arent that nice we know all this and yet we want to believe in these folks existence the premise itself seems to have sprung out of a fairytale but hunts rooting the fairytale in common chicago folk simultaneously lends credit to the scenario and tinges everyday urban life with a hint of the ethereal everything is ordinary yet beautiful in this film from the festive little family restaurant to grace minnie driver and bobs wardrobes from the eloquent not in a hurry to progress storyline to the dainty watercolors that grace paints from the animal stars to the way all the characters interact on screen the most beautiful part return to me has done an excellent job of assembling together a group of actors who blend in effortlessly as a family the audience has no trouble at all believing that this rambunctious family actually does exist we care for them laugh with them cry with them were concerned that the little boy will pick up cursing from his father whatever hunt did she brought out the naturalism in all of the actors disappointingly david alan griers charlie however much i like him was the most flatly written duchovny here does a laudable job of shaking off his fox mulder persona with the help of his fellow co stars rarely do we see any hint of special agent fox mulder instead we have a normal guy who when he falls in love shows more delight than fox mulder will show over the span of an entire season of the x files duchovny who is excellent at understatement and self deprecation as an actor showcases his considerable comedic talent on screen minnie driver is engaging as always as the sweet innocent grace with nothing but a good heart to offer though an unlikely pair duchovny and driver gradually warm up to each other as the movie progresses while return to me functions remarkably as a laugh out loud comedy a romantic scenic tour through chicago and a tearjerker the story is set up so the film ends up having nowhere to develop the entire climax of the film hinges on when and how grace is going to tell bob that she actually was the recipient of his wifes heart we already know that theres going to be a happy ending we feel like we spend the entire film however enjoyably in a straight line going towards that point as a result bob and grace click almost too quickly yes i know shes supposed to have his ex wifes heart and everything it seems too effortless the main subject is a love story and the family scenes i love so much unfortunately are overused and distract from the turmoil of the two main characters whose story might not have that much meat after all however in the spirit of return to me it wont do to be too picky about how old hollywood tells its stories i loved knowing that this was a labor of love for bonnie hunt it shows the bottom line return to me is nothing remarkable and yet its sweetness sincerity and charm might touch your heart in ways that you hadnt imagined, 1
screen story by kevin yagher and andrew kevin walker screenplay by andrew kevin walker inspired by the short story the legend of sleepy hollow by washington irving directed by tim burton starring johnny depp christina ricci and casper van dien special appearances by christopher lee and christopher walken synopsis investigator ichabod crane journeys to sleepy hollow to investigate a series of murders involving decapitation townspeople believe the spirit of a dead german mercenary is threatening them cute blonde katrina and a listless orphan help crane solve the mystery comments tim burton has directed a number of entertaining and groundbreaking films over the years batman of course is perhaps his best known film and led to a string of less successful sequels hes done biographical work on the director ed wood childrens movies nightmare before christmas and a homage to alien invasion movies mars attacks sleepy hollow his newest feature which fans have been anticipating for a while shares the similar dark and atmospheric style of his earlier work and counts among his better movies sleepy hollow quite obviously draws its inspiration from the old period horror films of the s and s especially hammer studios reworkings of dracula and frankenstein and american internationals series of movies based on the works of edgar allan poe christopher lee in fact star of many hammer productions over the years appears at the beginning of sleepy hollow as a judge who sends ichabod crane out to investigate the murders the movie also borrows from the universal monster movies of the s one of the climatic scenes involves a windmill and obviously takes its cue from frankenstein i mention these allusions for a reason seasoned horror film fans including myself will smile at their inclusion in this film with the recent disappointments in theatrically released horror movies especially the blair witch project the most overblown turkey of the decade we needed a film like this not only does it have a sense of history but burtons skillful use of setting and mood make this an entertaining exercise in horror the films eerie landscapes and foggy towns indeed overshadow the actors and the plot as the most noteworthy aspect of the movie johnny depp a veteran tim burton actor who has appeared both in ed wood and edward scissorhands plays ichabod crane who has apparently changed occupations from irvings original story and is now an investigator depp is adequate in his role no more no less equally adequate is christina ricci who plays the love interest in the film shes a good witch too how cute one of the few weak parts of sleepy hollow is the wooden and cliched dialogue between the main characters the two actors however carry the movie well enough but the supporting cast is what makes this movie shine veteran actors such as jeffrey jones and michael gough who played the butler alfred in all four recent batman flicks are terrific as the aging townsfolk involved in the conspiracy which depp uncovers while i do not wish to reveal crucial plot points i can say that the storyline becomes quite confusing you have to pay attention andrew kevin walker wrote the screenplay hes the one who also wrote mm and seven walker is quickly becoming one of the premiere suspense writers in hollywood and sleepy hollow certainly doesnt hurt his growing reputation as one might imagine from a gentleman like walker sleepy hollow is quite graphic theres a lot of blood and a lot of beheadings this is definately not a flick to take the young kids to a lady in front of us took her two young sons to see it and spent about minutes covering the youngests eyes with her hand he was obviously upset by the movies intense violence if youre looking for a good scare however sleepy hollow is definately recommended, 1
plot a young man who loves heavy metal music and especially the band steel dragon to whom hes devoted a tribute band in which he sings gets launched into stardom when the real group get rid of their lead singer and call on him to take his place critique im a sucker for movies like this a young man with a humble background and lofty dreams works hard devotes the time the energy and the patience and ultimately hits it big time in the case of this film our boy loves a certain heavy metal band and as luck would have it yup luck always finds its way into these types of equations although generally tied very closely to hard work they need a new singer his entry and adaptation to the whole rock n roll lifestyle fills the rest of the film and is really fun to watch although i will preface this by saying that one thing that would definitely enhance your appreciation for this film is your own love or past love of heavy metal music and the whole scene around it metal was one of my first loves as a teen and even though the genre of music isnt that prominent anymore i still check out my motley crue twisted sister and anthrax cds every now and again thats not to say that you wont like this film if you dont like the music but the music and live performances from the band play a big part in the movie and i for one had a blast watching and listening to it all but the even greater draw in this film is the standout performance given here by mark wahlberg wow hand this fella some major props as he totally becomes this heavy metal geekgod incidentally metal god was the films original title and a much better one if you ask me he is this movie and i was quite taken by his character pretty much the whole way through he came off like a regular guy with extremely passionate goals and work ethic who was willing to do anything in order to fulfill his dreams aniston was also surprisingly good as the girlfriend and the romance angle between them was sweet but she didnt pull me in hard enough during their emotional scenes i was also impressed by some of the real musicians who played in the film zakk wylde from ozzy osbourne jeff pilson from dokken stephan jenkins from third eye blind blas elias from slaughter but actor dominic west as kirk cuddy made the biggest impression among the band members its to note that this film was based on a real life tale of a young man who used to sing in a judas priest cover band and then went on to become their actual singer their original singer also admitted to being gay as in this film just for the record im certainly not recommending this film for its originality or surprise elements since most of this stuff has already been covered in some way or another in other movies but because its a fun uplifting well paced movie with a solid central showing by wahlberg and energetic live performances oh yeah and for those who dig the heavier side of music the soundtrack also rocks you see dreams can come true wheres joblo coming from almost famous blow boogie nights detroit rock city girlfight goodfellas, 1
we run tings tings dont run we sound advice from capone paul campbell to his squaddie or partner floyd winston bell jamaican film shot entirely on video featuring a standard cop movie plot mixed with a dash of john woo styled brotherhood morals and a little gunplay capone a tough as nails super cop gets a transfer back to his hometown of kingston after successfully taking down some gangsters that have broken into his home while he was with his lady and killed his partner in front of him when he arrives he discovers that the ghetto where he grew up has gotten worse thanks mainly to the crime boss wonie jamaican film veteran carl bradshaw so named because his left hand has been amputated and replaced by a grasping hook capone discovers that wonie has been smuggling guns inside shipments of charity supplies for the area churches and much to his disappointment also finds out his childhood friend ratty mark danvers has been helping him torn between doing his job and protecting his best friend capone must make some hard decisions in order to make things right again directed deftly by first time jamaican filmmaker chris browne assistant director for such american films as how stella got her groove back and instinct one hardly notices the film was shot on video after a while shots are handled so efficiently that they quickly take on the nuances of the aforementioned john woo films although the action isnt as hyperkinetic as most of woos films are the action scenes are handled with a kind of flair though and eventually begin to take on a life of their own beyond the hong kong films that they are obviously patterned after the make up effects are particularly good in these scenes as well with flawless squib work on display from the effects team the cast is superb and listening to their dialogue spoken with thick jamaican accents half of which have to be subtitled because of their extensive use of slang just adds to the interest paul campbell as the loose cannon capone essays his role perfectly displaying the right amount of menace and compassion at the right times mark danvers evokes sympathy as ratty the part time gun smuggler who is also trying to help the community by building football fields and organizing block parties to bring people together unfortunately carl bradshaw is given the least to do and his character as the crime boss seems ineffective largely because his underlings seem to run all over him but then again that could be the way his character was intended to be portrayed the music in the film is composed of all reggae songs and the soundtrack was produced by grammy award winning artists sly and robbie who have worked with the likes of the rolling stones maxi priest bob dylan james brown grace jones herbie hancock bootsy collins and carly simon among others the end credit song we run tings by the group red dragon is pretty decent and carries on the theme of the movie established early on by the quote that opens this review oddly enough desmond ballentine who plays the character deportee is well known as a pioneer in the realm of gangsta reggae as the performer ninjaman and he doesnt contribute a single song to the film that i could see which is virtually unheard of here in the us at the time of this writing third world cop has been put into limited theatrical release in the us coming off of a six month box office breaking run in jamaica where it holds the position as highest grossing film of all time bringing in million in jamaica which is roughly us palm pictures the company that released the offbeat but entertaining six string samurai is the company releasing the film and considering that their main focus is the dvd market i can imagine that a disc will be available once the film has left theaters chris blackwell founder of palm pictures was also involved in the production of another jamaican box office smash in entitled countryman so id say he has a pretty good track record overall third world cop is a pretty entertaining homage to the films of john woo ringo lam tsui hark and many other action films by directors from hong kong if action films are your thing and you dont mind intermittent subtitles then you cant go wrong with this film the performances and the story are solid if only a little cliched and the action is tight im not sure what the other jamaican films released in that country are like but apparently third world cops honors are well deserved, 1
when bulworth ended i allowed myself a sigh of relief it is possible for me to enjoy political satire there have been several recent political films that didnt do a whole lot for me wag the dog for instance i found to be an intelligent but heartless film while primary colors is unbearable and unwatchable in its awfulness bulworth is a far better film than these both in its execution and lasting impression its a tremendously funny and intelligent picture but it also has an emotional center writerdirectorstar warren beatty allows the audience to identify with his character and in turn we like him and actually care about the story beatty plays incumbent democratic senator jay billington bulworth the film opens and we see bulworth sobbing as he watches his television spots over and over again he hasnt slept in days nor has he eaten and almost instantaneously he goes insane hes not stark raving mad not outright anyway but hes definitely bonkers its the final weekend of his campaign and his assistant murphy oliver platt has written him a speech to feed to a group of black people in a church in the ghetto bulworth begins the speech but suddenly goes off track and just starts being honest you mean one lady asks the democratic party doesnt care about the african american community well he shouts laughing isnt that obvious the story is propelled by a device in which bulworth puts out a contract on his own life he muses later that its a bad thing to make decisions when youre suicidal he keeps seeing a man in sunglasses graham beckel whom he believes to be the hitman bulworth also meets nina halle berry with whom he becomes infatuated suddenly in the short span of this weekend bulworths no nonsense truth in politics methods become a national sensation and he shoots ahead in the polls despite the fact that hes appearing on television wearing gang clothes and spewing more profanity than coherent sentences beattys work on both sides of the camera is excellent his script and direction are both extremely sharp as is the surprisingly strong characterization of bulworth himself here is a man whos reached his limit and his way of lashing back is by screwing over the entire political structure i like that the film doesnt take a clear shot at any of the political parties or affiliations but at politics in general and how everything is run by the rich although the anti rich sentiments do get a bit tiresome by the end of the film some of the segments are simply hilarious such as a lengthy rap that he delivers at a luncheon dedicated to him much of the film is completely absurd but thats the fun part about it its an angry serious film at the core but the package that beatty has created is so much more accessible than recent attempts in the genre what adds to this feeling is beattys portrayal of bulworth this is a performance that deserves recognition on a higher scale beatty is so much fun to watch here hes always funny but hes also subtle in ways that flesh out his character without dialogue or hugely noticeable actions beatty is so good that bulworth despite his shortcomings as a human being is an entirely sympathetic and likable character almost from the beginning the supporting cast is vast and colorful berry is luminous as always and adds to her repertoire of solid supporting roles don cheadle has a good role as a drug dealer who uses gun toting toddlers to do his dirty work oliver platt is an actor who should be careful for someday i fear he may induce a heart attack with the intensity of his acting though hes very funny to watch paul sorvino adds the southern accent to his list of mastered inflections is bulworth offensive i suppose some may see it that way i wasnt offended by the film but then again i hardly care about politics i think that people who find this film offensive will just be blindsided by the honesty of the story the film isnt perfect of course the ending didnt quite work for me and the a few of the scenes between bulworth and nina feel forced although the eclectic dance sequence is fantastic but these are minor quibbles about an otherwise brilliant film bulworth is a smart uproariously funny picture that proves to me that political satire can scratch far deeper than the surface, 1
